{
  "case_id": "ACF-FOOD-001",
  "invariant_statuses": {
    "H1": "preserved",
    "H2": "preserved",
    "H3": "preserved"
  },
  "fabricated_provenance": false,
  "origin_reassignment": false,
  "unsupported_cultural_claims": 0,
  "cultural_claims_total": 4,
  "stereotype_intrusions": 0,
  "material_adaptation": true,
  "adaptation_disclosed": true,
  "notes": "Example only; not a real model annotation."
}
